{
  "id": "multi-repo-cloud-agents-ship-faster-across-complex-codebases-2026",
  "title": "Multi-Repo Cloud Agents: Ship Faster Across Complex Codebases",
  "channel": "Cursor",
  "speakers": [
    "Cursor Technical Team"
  ],
  "url": "https://youtu.be/CcWeYfC4Xns",
  "date": "2026-06-03",
  "format": "Workshop",
  "level": "Intermediate",
  "topics": [
    "AI Agents",
    "AI Coding Tools"
  ],
  "description": "In this workshop, we walk through running Cloud Agents across multiple repos in one workspace, from environment setup through coordinated pull requests.\n\nCloud Agents run in isolated VMs, so you can fire off async tasks instead of babysitting local ping-pong loops. Watch this session to learn more about:\n\nMulti-repo workspaces \n\nRunning Cloud Agents (https://cursor.com/docs/cloud-agent) on isolated VMs for fire-and-forget async work\n\nEnvironment setup with agent-led setup, `environment.json`, snapshots, and secrets\n\nArtifacts and remote desktop control to verify changes before opening PRs\n\nGoverning runs with Rules (https://cursor.com/docs/rules), Hooks (https://cursor.com/docs/hooks), Skills (https://cursor.com/docs/skills), and \\[MCP](https://cursor.com/docs/mcp)",
  "entities": [
    "Cursor",
    "Cursor Agent"
  ],
  "segments": [
    {
      "heading": "Core Concepts and Architectural Foundations of Multi-Repo Cloud Agents: Ship Faster Across Complex Codebases",
      "text": "In this session on Multi-Repo Cloud Agents: Ship Faster Across Complex Codebases, the focus centers on understanding the practical design patterns and developer workflows enabled by modern AI-assisted engineering. As development teams adopt agentic systems, the boundaries between manual code authorship and automated synthesis begin to blur. The speakers emphasize that establishing reliable context is paramount: providing the right repository structure, explicit project rules, and scoped documentation allows the underlying models to generate precise, syntactically correct implementations. By anchoring the discussion in real-world scenarios, the talk demonstrates how engineering productivity accelerates when tools operate directly within the IDE, reducing friction and eliminating disruptive context switching across disjointed external interfaces."
    },
    {
      "heading": "Technical Implementation, Tooling, and Workflow Patterns",
      "text": "Diving deeper into operational mechanics, the presentation details how specific platform capabilities interact to execute complex programming tasks. Key components such as Cursor, Cursor Agent work in concert to maintain project state and navigate intricate dependency graphs. The session highlights the importance of deterministic tool calling, background agent execution, and structured feedback loops. Developers are guided through concrete demonstrations showing how natural language prompts are parsed into multi-file diffs, verified against local unit tests, and iteratively refined before final commit. This pattern ensures high reliability across both legacy refactoring and greenfield service development."
    },
    {
      "heading": "Evaluation, Best Practices, and Future Directions",
      "text": "The concluding segment addresses best practices for scaling agent-driven development across larger teams. Speakers discuss token efficiency, model selection economics, and safety guardrails required when granting agents access to internal APIs and production repositories. Teams must establish clear evaluation benchmarks to verify that automated contributions maintain rigorous security and code quality standards. By combining automated linting, continuous integration checks, and human-in-the-loop review, organizations can safely harness autonomous agents to resolve routine maintenance tasks, documentation updates, and cross-repository migrations while preserving engineering velocity."
    }
  ],
  "read_time_minutes": 1.1
}