{
  "id": "cursor-for-knowledge-work-2026",
  "title": "Cursor for Knowledge Work",
  "channel": "Cursor",
  "speakers": [
    "Emily Guereno"
  ],
  "url": "https://youtu.be/_79pdMIaSAg",
  "date": "2026-05-05",
  "format": "Workshop",
  "level": "Beginner",
  "topics": [
    "AI Coding Tools",
    "AI Agents"
  ],
  "description": "In this workshop, Emily and George from Cursor's Growth Team show how knowledge workers can use Cursor to automate repetitive workflows, across data analysis, deep research, and writing emails.\n\nKey workflows covered:\n\nData analysis:\n\nQuery CSVs or live databases via MCP in plain English. Use /canvas to generate interactive dashboards in the IDE, or build a shareable Next.js app.\n\nMeeting recaps:\n\nConnect Granola or Google Calendar via MCP to summarize the past week of meetings and extract action items. Set as a weekly Automation to get a Monday morning Slack briefing automatically.\n\nEmail drafting:\n\nTrigger an agent to pull context from your CRM, product data, Notion, Slack, and more - then draft a personalized reply.\n\nAutomations:\n\nRun agents on a schedule or from external triggers. Supported triggers include Time, Slack, GitHub, GitLab, Linear, and custom Webhooks.\n\nSkills:\n\nSave a successful agent workflow as a reusable skill.",
  "entities": [
    "Cursor",
    "Slack",
    "GitHub",
    "Cursor Agent"
  ],
  "segments": [
    {
      "heading": "Core Concepts and Architectural Foundations of Cursor for Knowledge Work",
      "text": "In this session on Cursor for Knowledge Work, the focus centers on understanding the practical design patterns and developer workflows enabled by modern AI-assisted engineering. As development teams adopt agentic systems, the boundaries between manual code authorship and automated synthesis begin to blur. The speakers emphasize that establishing reliable context is paramount: providing the right repository structure, explicit project rules, and scoped documentation allows the underlying models to generate precise, syntactically correct implementations. By anchoring the discussion in real-world scenarios, the talk demonstrates how engineering productivity accelerates when tools operate directly within the IDE, reducing friction and eliminating disruptive context switching across disjointed external interfaces."
    },
    {
      "heading": "Technical Implementation, Tooling, and Workflow Patterns",
      "text": "Diving deeper into operational mechanics, the presentation details how specific platform capabilities interact to execute complex programming tasks. Key components such as Cursor, Slack, GitHub work in concert to maintain project state and navigate intricate dependency graphs. The session highlights the importance of deterministic tool calling, background agent execution, and structured feedback loops. Developers are guided through concrete demonstrations showing how natural language prompts are parsed into multi-file diffs, verified against local unit tests, and iteratively refined before final commit. This pattern ensures high reliability across both legacy refactoring and greenfield service development."
    },
    {
      "heading": "Evaluation, Best Practices, and Future Directions",
      "text": "The concluding segment addresses best practices for scaling agent-driven development across larger teams. Speakers discuss token efficiency, model selection economics, and safety guardrails required when granting agents access to internal APIs and production repositories. Teams must establish clear evaluation benchmarks to verify that automated contributions maintain rigorous security and code quality standards. By combining automated linting, continuous integration checks, and human-in-the-loop review, organizations can safely harness autonomous agents to resolve routine maintenance tasks, documentation updates, and cross-repository migrations while preserving engineering velocity."
    }
  ],
  "read_time_minutes": 1.1
}