{
  "id": "the-agentic-data-cloud-powering-a-system-2026",
  "title": "The agentic data cloud: Powering a system of action",
  "channel": "Google Cloud",
  "speakers": [
    "Andi Gutmans",
    "Yasmeen Ahmad",
    "Gabe Weiss",
    "Sean Zinsmeister",
    "Ignacio Garcia"
  ],
  "url": "https://youtu.be/JkmmDL386c4",
  "date": "2026-06-26",
  "format": "Talk",
  "level": "Advanced",
  "topics": [
    "AI Agents",
    "Product/Startup"
  ],
  "description": "Legacy architectures designed for human speed can’t survive the shift to agent scale. You must evolve from a system of intelligence to a system of action. Andi Gutmans and Yasmeen Ahmad will introduce the agentic data cloud - the world’s first architecture built to power the physics of autonomy. Spanning AI-powered analytics, data science, and agentic development, we’ll show you how to activate data anywhere in an open ecosystem, enforce universal knowledge to close the trust gap, and deploy an AI-native stack that solves the cost of scale.",
  "entities": [
    "BigQuery",
    "Compute Engine",
    "Gemini",
    "Gemini CLI",
    "Gemini Enterprise",
    "Google Cloud",
    "Palo Alto Networks"
  ],
  "segments": [
    {
      "heading": "Strategic Overview and Core Architecture in The agentic data cloud: Powering a syste",
      "text": "Please welcome Google Cloud vice president and general manager, Data Cloud, Andy gutmans. It's great to be back at next. Yesterday Thomas showed you our vision for the agentic enterprise. He showed you a world where your business isn't just a series of apps, but a single harmonious system. At the heart of that system, the very thing that gives an agent the ability to perceive, reason and act is data to make these agents work, to make them truly incredible. We need to completely flip the script on how we think about data powering AI because there are three fundamental shifts happening right now."
    },
    {
      "heading": "System Capabilities, Implementation Details, and Agent Integration",
      "text": "Down those walled gardens, giving your agents the freedom to activate data across any Cloud, any format, without forcing you into a multi-year modernization project. You just don't have time for and can't afford. Last but not least, it has to be trusted. The bridge between intelligence and action is trust. You can't allow an agent to execute a transaction unless it is grounded in your business reality. Today, we're excited to introduce the world's first agentic Data Cloud."
    },
    {
      "heading": "Operational Workflows, Security Controls, and Scalability",
      "text": "Today, I'm playing the role of a head of operations for a global robotics company. Before I came out, I received a unique alert from what our developers are calling our agentic data experience. It's a proactive insight into a sudden 40% spike in order cancelations. Checking the email, the agent has already deep dived on our data, analyzing historical sales patterns and correlating them with our live operational metrics. The agent has created a brief summary with a link to the data agent for further investigation. The agents kicked off this conversational thread with a helpful summary analysis and visualization of the root cause."
    },
    {
      "heading": "Enterprise Impact, Practical Takeaways, and Future Directions",
      "text": "This traverses and creates broader relationships in the data using the knowledge catalog API. I'm not going to lie to you, this does take a bit longer than we have in the demo. But what I can do is show you a visualization of that right here within my Ide. For example, I can see the relationship between our transactions date and our marketing campaigns. Now our agent has the context it needs about our data. The final step, let's create the proactive agent that actually uses the graph."
    }
  ],
  "read_time_minutes": 1.5
}