{
  "id": "how-ai-helps-solve-medical-mysteries-at-boston-childrens-hospital-openai-forum-2026",
  "title": "How AI Helps Solve Medical Mysteries at Boston Children’s Hospital | OpenAI Forum",
  "channel": "OpenAI",
  "speakers": [
    "Stav Rones",
    "Dr. Kathryn Brownstein",
    "Dr. Alan Beggs",
    "Suyash Shringarpure"
  ],
  "url": "https://youtu.be/SJJBPwlPpww",
  "date": "2026-08-05",
  "format": "Panel",
  "level": "Advanced",
  "topics": [
    "Research/Papers",
    "LLM Fundamentals"
  ],
  "description": "For many families living with a rare disease, the hardest part is not having a name for what is happening. Even with modern genetic testing, about half of people with rare diseases remain undiagnosed.\n\nIn this OpenAI Forum conversation, researchers from Boston Children’s Hospital's Manton Center for Orphan Disease Research discuss how they used OpenAI o3 Deep Research to reanalyze difficult pediatric cases and surface new leads for expert review. The conversation explores how AI can help scientists move faster, give families a better chance at answers, and support advanced medical research, while keeping geneticists and clinicians at the center of diagnosis and care.\n\nJoin the OpenAI Forum to explore more conversations with experts working at the forefront of AI, science, and society: https://forum.openai.com/",
  "entities": [
    "OpenAI",
    "Boston Children's Hospital",
    "Manton Center",
    "o3 Deep Research",
    "Genome Analysis"
  ],
  "segments": [
    {
      "heading": "Core Architecture and Technical Motivations for How AI Helps Solve Medical Mysteries at Boston Children’s Hospital | OpenAI Forum",
      "text": "In this session on How AI Helps Solve Medical Mysteries at Boston Children’s Hospital | OpenAI Forum, Stav Rones, Dr. Kathryn Brownstein, Dr. Alan Beggs, Suyash Shringarpure examine the underlying architectural principles and operational requirements shaping frontier AI systems. The presentation highlights how modern engineering teams leverage OpenAI, Boston Children's Hospital, Manton Center to address foundational challenges in Research/Papers, LLM Fundamentals. Rather than relying on rigid heuristic pipelines, the architecture emphasizes end-to-end model legibility, structured context windows, and robust feedback loops. Participants explore how these patterns eliminate brittle manual glue code, providing a resilient platform capable of maintaining accuracy even under intense compute constraints and rapid requirement iteration."
    },
    {
      "heading": "Implementation Mechanics, System Workflows, and Tool Integrations",
      "text": "Diving into technical mechanics, the speakers demonstrate concrete implementation workflows using OpenAI, Boston Children's Hospital, Manton Center. Key engineering workflows center on deterministic execution pipelines, rigorous schema validation, and low-latency data flow. By decomposing complex objectives into auditable intermediate states, developers can reliably track token expenditures, isolate runtime anomalies, and enforce strict execution boundaries. The session walks through hands-on architectures where automated orchestration safely manages high-concurrency requests, external API calls, and persistent state stores."
    },
    {
      "heading": "Operational Deployment, Evaluation Benchmarks, and Future Trajectory",
      "text": "The concluding segment addresses enterprise deployment standards, cost efficiency trade-offs, and empirical evaluation benchmarks. Speakers present metrics for assessing reliability in production environments, emphasizing continuous evaluation against realistic task distributions. Organizations deploying OpenAI, Boston Children's Hospital, Manton Center must balance inference latency with reasoning depth, ensuring that guardrails and safety invariants remain intact throughout system lifecycle. Looking ahead, the discussion outlines upcoming platform milestones and strategic paradigms for scaling autonomous, high-integrity AI workloads across diverse industry domains."
    }
  ],
  "read_time_minutes": 1.0
}
