{
  "id": "teaching-agents-to-learn-from-your-2026",
  "title": "Teaching agents to learn from your team",
  "channel": "Claude",
  "speakers": [
    "Claude Engineering Team"
  ],
  "url": "https://youtu.be/uGroRwlC9y4",
  "date": "2026-05-22",
  "format": "Talk",
  "level": "Intermediate",
  "topics": [
    "AI Agents"
  ],
  "description": "Agent that improves itself daily by treating instructions as code: edited, reviewed, merged like any PR. Writing skills that teach agents how to think (not what to do). Closing feedback loop so team judgment flows back automatically.",
  "entities": [
    "Claude"
  ],
  "segments": [
    {
      "heading": "Architectural Overview and System Objectives in Teaching agents to learn from your team",
      "text": "Agent that improves itself daily by treating instructions as code: edited, reviewed, merged like any PR. Writing skills that teach agents how to think (not what to do). Closing feedback loop so team judgment flows back automatically. The session details foundational design principles, execution patterns, and operational integration requirements within the AI Agents domain."
    },
    {
      "heading": "Technical Capabilities, Tooling Integration, and Protocols",
      "text": "Speakers analyze technical capabilities across Claude. The architecture highlights reliable agent tool use, context window optimization, protocol standards, and seamless workflow interoperability."
    },
    {
      "heading": "Production Deployment, Verification, and Best Practices",
      "text": "Production readiness demands robust evaluation harnesses, state validation, and error-handling loops. Teams implement systematic monitoring and guardrails to ensure reliability across repeated executions."
    },
    {
      "heading": "Organizational Impact, Scalability, and Industry Outlook",
      "text": "Deploying agentic systems transforms developer and team workflows by automating high-friction tasks. Organizations scale safely by pairing automated tool orchestration with structured human review."
    }
  ],
  "read_time_minutes": 1.0
}